{
  "schema_version": "1.0",
  "topic_id": "08-title-es-nulo",
  "topic_number": 8,
  "title_ru": "title_es=null и необязательные stats-поля=null",
  "title_es": null,
  "created_at": "2026-01-15T10:35:00.000Z",
  "generator_version": "1.0.0",
  "config": {
    "provider": "mock_say",
    "model": "macos_say",
    "voice_es": { "id": "Monica", "name": "Mónica" },
    "voice_ru": { "id": "Milena", "name": "Milena" }
  },
  "stats": {
    "phrase_count": 0,
    "vocab_count": 1,
    "story_count": 0,
    "total_elements": 1,
    "characters_es": 7,
    "characters_ru": 3,
    "total_characters": 10,
    "estimated_cost_usd": null,
    "actual_cost_usd": null,
    "generation_duration_seconds": null,
    "file_size_mb": null
  },
  "blocks": [
    {
      "block_id": "b1",
      "type": "vocabulary",
      "title_ru": "Лексика",
      "title_es": null,
      "order_index": 0,
      "words": [
        {
          "id": "08-b1-vocab-01",
          "es": "el gato",
          "ru": "кот",
          "audio": { "es": "audio/es/08-b1-vocab-01.mp3", "ru": "audio/ru/08-b1-vocab-01.mp3" },
          "duration_ms": { "es": 500, "ru": 400 },
          "status": "pending",
          "generated_at": null,
          "error": null
        }
      ]
    }
  ]
}
