{
  "schema_version": "1.0",
  "topic_id": "03-config-nulos",
  "topic_number": 3,
  "title_ru": "Config с нулями и null (stability=0, similarity_boost=0, seed=null)",
  "created_at": "2026-01-15T10:10:00.000Z",
  "generator_version": "1.0.0",
  "config": {
    "provider": "elevenlabs",
    "model": "eleven_flash_v2_5",
    "voice_es": { "id": "voice-es-1", "name": "Diego" },
    "voice_ru": { "id": "voice-ru-1", "name": "Milena" },
    "stability": 0,
    "similarity_boost": 0,
    "seed": null
  },
  "stats": {
    "phrase_count": 0,
    "vocab_count": 1,
    "story_count": 0,
    "total_elements": 1,
    "characters_es": 7,
    "characters_ru": 3,
    "total_characters": 10
  },
  "blocks": [
    {
      "block_id": "b1",
      "type": "vocabulary",
      "title_ru": "Лексика",
      "order_index": 0,
      "words": [
        {
          "id": "03-b1-vocab-01",
          "es": "el gato",
          "ru": "кот",
          "audio": { "es": "audio/es/03-b1-vocab-01.mp3", "ru": "audio/ru/03-b1-vocab-01.mp3" },
          "duration_ms": { "es": 500, "ru": 400 },
          "status": "pending"
        }
      ]
    }
  ]
}
