{
  "schema_version": "1.0",
  "topic_id": "02-solo-historia",
  "topic_number": 2,
  "title_ru": "Урок только с рассказом",
  "created_at": "2026-01-15T10:05:00.000Z",
  "generator_version": "1.0.0",
  "config": {
    "provider": "mock_say",
    "model": "macos_say",
    "voice_es": { "id": "Monica", "name": "Mónica" },
    "voice_ru": { "id": "Milena", "name": "Milena" }
  },
  "stats": {
    "phrase_count": 0,
    "vocab_count": 0,
    "story_count": 1,
    "total_elements": 1,
    "characters_es": 11,
    "characters_ru": 11,
    "total_characters": 22
  },
  "blocks": [
    {
      "block_id": "b1",
      "type": "story",
      "title_ru": "Короткий рассказ",
      "order_index": 0,
      "text_es": "Hola mundo.",
      "text_ru": "Привет мир.",
      "audio": { "es": "audio/es/02-b1-story.mp3", "ru": "audio/ru/02-b1-story.mp3" },
      "duration_ms": { "es": 0, "ru": 0 },
      "status": "pending"
    }
  ]
}
