{
  "schema_version": "1.0",
  "topic_id": "04-unicode",
  "topic_number": 4,
  "title_ru": "Юникод в текстах 🌍",
  "created_at": "2026-01-15T10:15:00.000Z",
  "generator_version": "1.0.0",
  "config": {
    "provider": "mock_say",
    "model": "macos_say",
    "voice_es": { "id": "Monica", "name": "Mónica" },
    "voice_ru": { "id": "Milena", "name": "Milena" }
  },
  "stats": {
    "phrase_count": 0,
    "vocab_count": 1,
    "story_count": 0,
    "total_elements": 1,
    "characters_es": 31,
    "characters_ru": 21,
    "total_characters": 52
  },
  "blocks": [
    {
      "block_id": "b1",
      "type": "vocabulary",
      "title_ru": "Лексика 日本語",
      "order_index": 0,
      "words": [
        {
          "id": "04-b1-vocab-01",
          "es": "¡Hola! 👋 café niño 日本語",
          "ru": "Привет 👋 кофе мальчик",
          "audio": { "es": "audio/es/04-b1-vocab-01.mp3", "ru": "audio/ru/04-b1-vocab-01.mp3" },
          "duration_ms": { "es": 900, "ru": 850 },
          "status": "pending"
        }
      ]
    }
  ]
}
