{
  "schema_version": "1.0",
  "topic_id": "09-todos-los-tipos",
  "topic_number": 9,
  "title_ru": "По одному блоку каждого из 4 типов",
  "created_at": "2026-01-15T10:40:00.000Z",
  "generator_version": "1.0.0",
  "config": {
    "provider": "mock_say",
    "model": "macos_say",
    "voice_es": { "id": "Monica", "name": "Mónica" },
    "voice_ru": { "id": "Milena", "name": "Milena" }
  },
  "stats": {
    "phrase_count": 2,
    "vocab_count": 1,
    "story_count": 1,
    "total_elements": 4,
    "characters_es": 27,
    "characters_ru": 25,
    "total_characters": 52
  },
  "blocks": [
    {
      "block_id": "b1",
      "type": "verb_group",
      "title_ru": "Глаголы",
      "order_index": 0,
      "groups": [
        {
          "key": "tener",
          "translation_ru": "иметь",
          "order_index": 0,
          "phrases": [
            {
              "id": "09-b1-tener-01",
              "es": "Tengo.",
              "ru": "Имею.",
              "audio": { "es": "audio/es/09-b1-tener-01.mp3", "ru": "audio/ru/09-b1-tener-01.mp3" },
              "duration_ms": { "es": 400, "ru": 350 },
              "status": "done"
            }
          ]
        }
      ]
    },
    {
      "block_id": "b2",
      "type": "phrase_group",
      "title_ru": "Фразы",
      "order_index": 1,
      "groups": [
        {
          "key": "saludos",
          "title_ru": "Приветствия",
          "order_index": 0,
          "phrases": [
            {
              "id": "09-b2-saludos-01",
              "es": "Hola.",
              "ru": "Привет.",
              "audio": { "es": "audio/es/09-b2-saludos-01.mp3", "ru": "audio/ru/09-b2-saludos-01.mp3" },
              "duration_ms": { "es": 350, "ru": 380 },
              "status": "done"
            }
          ]
        }
      ]
    },
    {
      "block_id": "b3",
      "type": "vocabulary",
      "title_ru": "Лексика",
      "order_index": 2,
      "words": [
        {
          "id": "09-b3-vocab-01",
          "es": "el gato",
          "ru": "кот",
          "audio": { "es": "audio/es/09-b3-vocab-01.mp3", "ru": "audio/ru/09-b3-vocab-01.mp3" },
          "duration_ms": { "es": 500, "ru": 400 },
          "status": "done"
        }
      ]
    },
    {
      "block_id": "b4",
      "type": "story",
      "title_ru": "Короткий рассказ",
      "order_index": 3,
      "text_es": "Hola mundo.",
      "text_ru": "Привет мир.",
      "audio": { "es": "audio/es/09-b4-story.mp3", "ru": "audio/ru/09-b4-story.mp3" },
      "duration_ms": { "es": 900, "ru": 950 },
      "status": "done",
      "split_by_phrase": false
    }
  ]
}
